<?xml version="1.0" encoding="utf-8"?>
<calculation application="knr" created="2016-07-08T00:11:18" version="1.7" xmlns="http://legal.pecina.cz" xmlns:xsi="http://www.w3.org/2001/XMLSchema-instance" xsi:schemaLocation="http://legal.pecina.cz https://legal.pecina.cz/static/knr-1.7.xsd"><title>Příliš žluťoučký kůň úpěnlivě přepíná ďábelské kódy</title><calculation_note>Poznámka</calculation_note><internal_note>Interní poznámka</internal_note><vat_rate unit="percentage">21.00</vat_rate><items><general><description>Zaplacený soudní poplatek</description><amount currency="CZK">300</amount><vat>false</vat><numerator>2</numerator><denominator>3</denominator><item_note>Poznámka</item_note></general><general><description>Zaplacená záloha na znalecký posudek</description><amount currency="CZK">2000</amount><vat>false</vat><numerator>2</numerator><denominator>3</denominator><item_note></item_note></general><general><description>Zaplacená záloha na svědečné</description><amount currency="CZK">826</amount><vat>false</vat><numerator>2</numerator><denominator>3</denominator><item_note></item_note></general><travel><description>Náhrada za použití motorového vozidla (klient)</description><amount currency="CZK">1241</amount><vat>false</vat><numerator>2</numerator><denominator>3</denominator><item_note></item_note><from_name>Krajský soud v Brně</from_name><from_address>Rooseveltova 648/16, 602 00 Brno, Česká republika</from_address><from_lat datum="WGS84" unit="deg">49.1967243</from_lat><from_lon datum="WGS84" unit="deg">16.6119663</from_lon><to_name>Krajský soud v Brně, pobočka v Jihlavě</to_name><to_address>tř. Legionářů 5277/9a, 586 01 Jihlava, Česká republika</to_address><to_lat datum="WGS84" unit="deg">49.4011190</to_lat><to_lon datum="WGS84" unit="deg">15.5845102</to_lon><trip_number>2</trip_number><trip_distance unit="km">94</trip_distance><time_rate currency="CZK" unit="per half-hour">0</time_rate><time_number unit="half-hour">3</time_number><car_name>Zkušební vozidlo</car_name><fuel_name>NM</fuel_name><cons1 unit="l per 100 km">11.9</cons1><cons2 unit="l per 100 km">7.5</cons2><cons3 unit="l per 100 km">9.1</cons3><formula_name>Vyhláška č. 385/2015 Sb.</formula_name><flat_rate currency="CZK" unit="per km">3.80</flat_rate><fuel_price currency="CZK" unit="per l">29.50</fuel_price></travel><general><description>Další hotové výdaje (klient)</description><amount currency="CZK">28</amount><vat>false</vat><numerator>2</numerator><denominator>3</denominator><item_note></item_note></general><service><description>Mimosmluvní odměna za úkony právní služby podle advokátního tarifu</description><amount currency="CZK">8100</amount><vat>false</vat><numerator>2</numerator><denominator>3</denominator><item_note></item_note><major_number>5</major_number><rate currency="CZK">1620</rate><minor_number>0</minor_number><multiple_number>1</multiple_number><off10_flag>false</off10_flag><off30_flag>false</off30_flag><off30limit5000_flag>false</off30limit5000_flag></service><flat><description>Paušální odměna za zastupování účastníka podle vyhlášky č. 484/2000 Sb.</description><amount currency="CZK">400</amount><vat>false</vat><numerator>2</numerator><denominator>3</denominator><rate currency="CZK">1500</rate><multiple_flag>false</multiple_flag><multiple50_flag>false</multiple50_flag><item_note></item_note><single_flag>true</single_flag><halved_flag>true</halved_flag><halved_appeal_flag>false</halved_appeal_flag><collection_flag>false</collection_flag></flat><general><description>Paušální odměna za zastupování účastníka stanovená pevnou částkou</description><amount currency="CZK">500</amount><vat>false</vat><numerator>2</numerator><denominator>3</denominator><item_note></item_note></general><travel><description>Náhrada za použití motorového vozidla (advokát)</description><amount currency="CZK">1841</amount><vat>false</vat><numerator>2</numerator><denominator>3</denominator><item_note></item_note><from_name>Krajský soud v Brně</from_name><from_address>Rooseveltova 648/16, 602 00 Brno, Česká republika</from_address><from_lat datum="WGS84" unit="deg">49.1967243</from_lat><from_lon datum="WGS84" unit="deg">16.6119663</from_lon><to_name>Krajský soud v Brně, pobočka v Jihlavě</to_name><to_address>tř. Legionářů 5277/9a, 586 01 Jihlava, Česká republika</to_address><to_lat datum="WGS84" unit="deg">49.4011190</to_lat><to_lon datum="WGS84" unit="deg">15.5845102</to_lon><trip_number>2</trip_number><trip_distance unit="km">94</trip_distance><time_rate currency="CZK" unit="per half-hour">100</time_rate><time_number unit="half-hour">3</time_number><car_name>Zkušební vozidlo</car_name><fuel_name>NM</fuel_name><cons1 unit="l per 100 km">11.9</cons1><cons2 unit="l per 100 km">7.5</cons2><cons3 unit="l per 100 km">9.1</cons3><formula_name>Vyhláška č. 385/2015 Sb.</formula_name><flat_rate currency="CZK" unit="per km">3.80</flat_rate><fuel_price currency="CZK" unit="per l">29.50</fuel_price></travel><time><description>Náhrada za promeškaný čas podle advokátního tarifu</description><amount currency="CZK">400</amount><vat>false</vat><numerator>2</numerator><denominator>3</denominator><item_note></item_note><time_number unit="half-hour">4</time_number><time_rate currency="CZK" unit="per half-hour">100</time_rate></time><administrative><description>Paušální náhrada za úkony právní služby podle advokátního tarifu</description><amount currency="CZK">900</amount><vat>false</vat><numerator>2</numerator><denominator>3</denominator><item_note></item_note><number>3</number><rate currency="CZK">300</rate></administrative><general><description>Další hotové výdaje (advokát)</description><amount currency="CZK">700</amount><vat>false</vat><numerator>2</numerator><denominator>3</denominator><item_note></item_note></general><service><description>Mimosmluvní odměna za úkony právní služby podle advokátního tarifu</description><amount currency="CZK">29500</amount><vat>true</vat><numerator>2</numerator><denominator>3</denominator><item_note></item_note><major_number>4</major_number><rate currency="CZK">5900</rate><minor_number>2</minor_number><multiple_number>1</multiple_number><off10_flag>false</off10_flag><off30_flag>false</off30_flag><off30limit5000_flag>false</off30limit5000_flag></service><flat><description>Paušální odměna za zastupování účastníka podle vyhlášky č. 484/2000 Sb.</description><amount currency="CZK">36070</amount><vat>true</vat><numerator>2</numerator><denominator>3</denominator><rate currency="CZK">36070</rate><multiple_flag>false</multiple_flag><multiple50_flag>false</multiple50_flag><item_note></item_note><single_flag>false</single_flag><halved_flag>false</halved_flag><halved_appeal_flag>false</halved_appeal_flag><collection_flag>false</collection_flag></flat><general><description>Paušální odměna za zastupování účastníka stanovená pevnou částkou</description><amount currency="CZK">900</amount><vat>true</vat><numerator>2</numerator><denominator>3</denominator><item_note></item_note></general><travel><description>Náhrada za použití motorového vozidla (advokát)</description><amount currency="CZK">1841</amount><vat>true</vat><numerator>2</numerator><denominator>3</denominator><item_note></item_note><from_name>Krajský soud v Brně</from_name><from_address>Rooseveltova 648/16, 602 00 Brno, Česká republika</from_address><from_lat datum="WGS84" unit="deg">49.1967243</from_lat><from_lon datum="WGS84" unit="deg">16.6119663</from_lon><to_name>Krajský soud v Brně, pobočka v Jihlavě</to_name><to_address>tř. Legionářů 5277/9a, 586 01 Jihlava, Česká republika</to_address><to_lat datum="WGS84" unit="deg">49.4011190</to_lat><to_lon datum="WGS84" unit="deg">15.5845102</to_lon><trip_number>2</trip_number><trip_distance unit="km">94</trip_distance><time_rate currency="CZK" unit="per half-hour">100</time_rate><time_number unit="half-hour">3</time_number><car_name>Zkušební vozidlo</car_name><fuel_name>NM</fuel_name><cons1 unit="l per 100 km">11.9</cons1><cons2 unit="l per 100 km">7.5</cons2><cons3 unit="l per 100 km">9.1</cons3><formula_name>Vyhláška č. 385/2015 Sb.</formula_name><flat_rate currency="CZK" unit="per km">3.80</flat_rate><fuel_price currency="CZK" unit="per l">29.50</fuel_price></travel><time><description>Náhrada za promeškaný čas podle advokátního tarifu</description><amount currency="CZK">700</amount><vat>true</vat><numerator>2</numerator><denominator>3</denominator><item_note></item_note><time_number unit="half-hour">7</time_number><time_rate currency="CZK" unit="per half-hour">100</time_rate></time><administrative><description>Paušální náhrada za úkony právní služby podle advokátního tarifu</description><amount currency="CZK">1800</amount><vat>true</vat><numerator>2</numerator><denominator>3</denominator><item_note></item_note><number>6</number><rate currency="CZK">300</rate></administrative><general><description>Další hotové výdaje (advokát)</description><amount currency="CZK">1430</amount><vat>true</vat><numerator>2</numerator><denominator>3</denominator><item_note></item_note></general></items></calculation>
