<?xml version="1.0" encoding="utf-8"?>
<calculation application="knr" created="2016-07-08T01:33:06" version="1.4" xmlns="http://legal.pecina.cz" xmlns:xsi="http://www.w3.org/2001/XMLSchema-instance" xsi:schemaLocation="http://legal.pecina.cz https://legal.pecina.cz/static/knr-1.7.xsd"><title></title><calculation_note></calculation_note><internal_note></internal_note><vat_rate unit="percentage">10.00</vat_rate><items><service><description>Mimosmluvní odměna za úkony právní služby podle advokátního tarifu</description><amount currency="CZK">20000</amount><vat>false</vat><numerator>2</numerator><denominator>3</denominator><item_note></item_note><major_number>10</major_number><rate currency="CZK">1000</rate><minor_number>20</minor_number><multiple_number>1</multiple_number><off10_flag>false</off10_flag><off30_flag>false</off30_flag><off30limit5000_flag>false</off30limit5000_flag></service><administrative><description>Paušální náhrada za úkony právní služby podle advokátního tarifu</description><amount currency="CZK">3000</amount><vat>true</vat><numerator>2</numerator><denominator>3</denominator><item_note></item_note><number>10</number><rate currency="CZK">300</rate></administrative><travel><description>Náhrada za použití motorového vozidla (advokát)</description><amount currency="CZK">1200</amount><vat>true</vat><numerator>2</numerator><denominator>3</denominator><item_note></item_note><from_name>Krajský soud v Brně</from_name><from_address>Rooseveltova 648/16, 602 00 Brno, Česká republika</from_address><from_lat datum="WGS84" unit="deg">49.1967243</from_lat><from_lon datum="WGS84" unit="deg">16.6119663</from_lon><to_name>Krajský soud v Brně, pobočka v Jihlavě</to_name><to_address>tř. Legionářů 5277/9a, 586 01 Jihlava, Česká republika</to_address><to_lat datum="WGS84" unit="deg">49.4011190</to_lat><to_lon datum="WGS84" unit="deg">15.5845102</to_lon><trip_number>1</trip_number><trip_distance unit="km">100</trip_distance><time_rate currency="CZK" unit="per half-hour">100</time_rate><time_number unit="half-hour">10</time_number><car_name>Zkušební vozidlo</car_name><fuel_name>NM</fuel_name><cons1 unit="l per 100 km">10.0</cons1><cons2 unit="l per 100 km">10.0</cons2><cons3 unit="l per 100 km">10.0</cons3><formula_name>Vyhláška č. 385/2015 Sb.</formula_name><flat_rate currency="CZK" unit="per km">1.00</flat_rate><fuel_price currency="CZK" unit="per l">10.00</fuel_price></travel></items></calculation>
